Sheet: Evaluation
A1: Percentual comparison of benchmark to “no_workaround”
A3: Each column is the percentage it took to execute that benchmark compared tot he “no_workaround” benchmark.
A6: Average - Time / rep (ms) | B6: benchmark
A7: CPU model | B7: no_workaround | C7: with_loc | D7: with_workaround
A8: AMD Ryzen 5 2400G with Radeon Vega Graphics | B8: 1 | C8: 1.05034078728111 | D8: 0.817513520634098
A9: AMD Ryzen 5 3500U with Radeon Vega Mobile Gfx | B9: 1 | C9: 1.01495266299449 | D9: 0.813805837400263
A10: AMD Ryzen 5 PRO 3400G with Radeon Vega Graphics | B10: 1 | C10: 1.03669540420039 | D10: 0.701356347596944
A11: AMD Ryzen 7 4700U with Radeon Graphics | B11: 1 | C11: 1.01866665106099 | D11: 0.817976981681552
A12: Intel(R) Core(TM) i3-7020U CPU @ 2.30GHz | B12: 1 | C12: 0.97207546104552 | D12: 0.884055598271277
A13: Intel(R) Core(TM) i5-5350U CPU @ 1.80GHz | B13: 1 | C13: 1.03089529493421 | D13: 0.798361604764152
A14: Intel(R) Core(TM) i7-4770HQ CPU @ 2.20GHz | B14: 1 | C14: 0.997151090564507 | D14: 0.915396342573964
A15: Total Result | B15: 1 | C15: 1.01014552851712 | D15: 0.834677264479712

Sheet: Normalized results
A1: benchmark | B1: CPU model | C1: Time / rep (ms)
A2: of:=[$'results.csv'.A3] -> no_workaround | B2: of:=[$'results.csv'.E3] -> AMD Ryzen 5 PRO 3400G with Radeon Vega Graphics | C2: of:=IFERROR(([$'results.csv'.D3]/[$'results.csv'.C3])*1000;0) -> 345.284840297998
A3: of:=[$'results.csv'.A4] -> with_loc | B3: of:=[$'results.csv'.E4] -> AMD Ryzen 5 PRO 3400G with Radeon Vega Graphics | C3: of:=IFERROR(([$'results.csv'.D4]/[$'results.csv'.C4])*1000;0) -> 357.955207077
A4: of:=[$'results.csv'.A5] -> with_workaround | B4: of:=[$'results.csv'.E5] -> AMD Ryzen 5 PRO 3400G with Radeon Vega Graphics | C4: of:=IFERROR(([$'results.csv'.D5]/[$'results.csv'.C5])*1000;0) -> 242.167714471998
A5: of:=[$'results.csv'.A6] -> no_workaround | B5: of:=[$'results.csv'.E6] -> AMD Ryzen 5 2400G with Radeon Vega Graphics | C5: of:=IFERROR(([$'results.csv'.D6]/[$'results.csv'.C6])*1000;0) -> 540.701800495386
A6: of:=[$'results.csv'.A7] -> with_loc | B6: of:=[$'results.csv'.E7] -> AMD Ryzen 5 2400G with Radeon Vega Graphics | C6: of:=IFERROR(([$'results.csv'.D7]/[$'results.csv'.C7])*1000;0) -> 567.921154816635
A7: of:=[$'results.csv'.A8] -> with_workaround | B7: of:=[$'results.csv'.E8] -> AMD Ryzen 5 2400G with Radeon Vega Graphics | C7: of:=IFERROR(([$'results.csv'.D8]/[$'results.csv'.C8])*1000;0) -> 442.031032536179
A8: of:=[$'results.csv'.A9] -> no_workaround | B8: of:=[$'results.csv'.E9] -> Intel(R) Core(TM) i7-4770HQ CPU @ 2.20GHz | C8: of:=IFERROR(([$'results.csv'.D9]/[$'results.csv'.C9])*1000;0) -> 529.270477404003
A9: of:=[$'results.csv'.A10] -> with_loc | B9: of:=[$'results.csv'.E10] -> Intel(R) Core(TM) i7-4770HQ CPU @ 2.20GHz | C9: of:=IFERROR(([$'results.csv'.D10]/[$'results.csv'.C10])*1000;0) -> 527.762633746999
A10: of:=[$'results.csv'.A11] -> with_workaround | B10: of:=[$'results.csv'.E11] -> Intel(R) Core(TM) i7-4770HQ CPU @ 2.20GHz | C10: of:=IFERROR(([$'results.csv'.D11]/[$'results.csv'.C11])*1000;0) -> 484.492259248
A11: of:=[$'results.csv'.A12] -> no_workaround | B11: of:=[$'results.csv'.E12] -> AMD Ryzen 5 3500U with Radeon Vega Mobile Gfx | C11: of:=IFERROR(([$'results.csv'.D12]/[$'results.csv'.C12])*1000;0) -> 420.531277493996
A12: of:=[$'results.csv'.A13] -> with_loc | B12: of:=[$'results.csv'.E13] -> AMD Ryzen 5 3500U with Radeon Vega Mobile Gfx | C12: of:=IFERROR(([$'results.csv'.D13]/[$'results.csv'.C13])*1000;0) -> 426.819339965005
A13: of:=[$'results.csv'.A14] -> with_workaround | B13: of:=[$'results.csv'.E14] -> AMD Ryzen 5 3500U with Radeon Vega Mobile Gfx | C13: of:=IFERROR(([$'results.csv'.D14]/[$'results.csv'.C14])*1000;0) -> 342.230808434004
A14: of:=[$'results.csv'.A15] -> no_workaround | B14: of:=[$'results.csv'.E15] -> Intel(R) Core(TM) i5-5350U CPU @ 1.80GHz | C14: of:=IFERROR(([$'results.csv'.D15]/[$'results.csv'.C15])*1000;0) -> 846.212536429
A15: of:=[$'results.csv'.A16] -> with_loc | B15: of:=[$'results.csv'.E16] -> Intel(R) Core(TM) i5-5350U CPU @ 1.80GHz | C15: of:=IFERROR(([$'results.csv'.D16]/[$'results.csv'.C16])*1000;0) -> 872.356522319
A16: of:=[$'results.csv'.A17] -> with_workaround | B16: of:=[$'results.csv'.E17] -> Intel(R) Core(TM) i5-5350U CPU @ 1.80GHz | C16: of:=IFERROR(([$'results.csv'.D17]/[$'results.csv'.C17])*1000;0) -> 675.583598555
A17: of:=[$'results.csv'.A18] -> no_workaround | B17: of:=[$'results.csv'.E18] -> AMD Ryzen 7 4700U with Radeon Graphics | C17: of:=IFERROR(([$'results.csv'.D18]/[$'results.csv'.C18])*1000;0) -> 394.450468750001
A18: of:=[$'results.csv'.A19] -> with_loc | B18: of:=[$'results.csv'.E19] -> AMD Ryzen 7 4700U with Radeon Graphics | C18: of:=IFERROR(([$'results.csv'.D19]/[$'results.csv'.C19])*1000;0) -> 401.813538011
A19: of:=[$'results.csv'.A20] -> with_workaround | B19: of:=[$'results.csv'.E20] -> AMD Ryzen 7 4700U with Radeon Graphics | C19: of:=IFERROR(([$'results.csv'.D20]/[$'results.csv'.C20])*1000;0) -> 322.651403850999
A20: of:=[$'results.csv'.A21] -> no_workaround | B20: of:=[$'results.csv'.E21] -> Intel(R) Core(TM) i3-7020U CPU @ 2.30GHz | C20: of:=IFERROR(([$'results.csv'.D21]/[$'results.csv'.C21])*1000;0) -> 660.964555230021
A21: of:=[$'results.csv'.A22] -> with_loc | B21: of:=[$'results.csv'.E22] -> Intel(R) Core(TM) i3-7020U CPU @ 2.30GHz | C21: of:=IFERROR(([$'results.csv'.D22]/[$'results.csv'.C22])*1000;0) -> 642.50742475997
A22: of:=[$'results.csv'.A23] -> with_workaround | B22: of:=[$'results.csv'.E23] -> Intel(R) Core(TM) i3-7020U CPU @ 2.30GHz | C22: of:=IFERROR(([$'results.csv'.D23]/[$'results.csv'.C23])*1000;0) -> 584.329415309985
A23: of:=[$'results.csv'.A18] -> no_workaround | B23: of:=[$'results.csv'.E18] -> AMD Ryzen 7 4700U with Radeon Graphics | C23: of:=IFERROR(([$'results.csv'.D18]/[$'results.csv'.C18])*1000;0) -> 394.450468750001
A24: of:=[$'results.csv'.A19] -> with_loc | B24: of:=[$'results.csv'.E19] -> AMD Ryzen 7 4700U with Radeon Graphics | C24: of:=IFERROR(([$'results.csv'.D19]/[$'results.csv'.C19])*1000;0) -> 401.813538011
A25: of:=[$'results.csv'.A20] -> with_workaround | B25: of:=[$'results.csv'.E20] -> AMD Ryzen 7 4700U with Radeon Graphics | C25: of:=IFERROR(([$'results.csv'.D20]/[$'results.csv'.C20])*1000;0) -> 322.651403850999
A26: of:=[$'results.csv'.A21] -> no_workaround | B26: of:=[$'results.csv'.E21] -> Intel(R) Core(TM) i3-7020U CPU @ 2.30GHz | C26: of:=IFERROR(([$'results.csv'.D21]/[$'results.csv'.C21])*1000;0) -> 660.964555230021
A27: of:=[$'results.csv'.A22] -> with_loc | B27: of:=[$'results.csv'.E22] -> Intel(R) Core(TM) i3-7020U CPU @ 2.30GHz | C27: of:=IFERROR(([$'results.csv'.D22]/[$'results.csv'.C22])*1000;0) -> 642.50742475997
A28: of:=[$'results.csv'.A23] -> with_workaround | B28: of:=[$'results.csv'.E23] -> Intel(R) Core(TM) i3-7020U CPU @ 2.30GHz | C28: of:=IFERROR(([$'results.csv'.D23]/[$'results.csv'.C23])*1000;0) -> 584.329415309985

Sheet: results.csv
A1: Replace these values with those from results.csv and refresh the pivot table on the other sheet
A2: benchmark | B2: frame size | C2: repetitions | D2: time | E2: CPU model | F2: CPU arch | G2: CPU count
A3: no_workaround | B3: 300000 | C3: 1000 | D3: 345.284840297998 | E3: AMD Ryzen 5 PRO 3400G with Radeon Vega Graphics | F3: x86_64 | G3: 8
A4: with_loc | B4: 300000 | C4: 1000 | D4: 357.955207077 | E4: AMD Ryzen 5 PRO 3400G with Radeon Vega Graphics | F4: x86_64 | G4: 8
A5: with_workaround | B5: 300000 | C5: 1000 | D5: 242.167714471998 | E5: AMD Ryzen 5 PRO 3400G with Radeon Vega Graphics | F5: x86_64 | G5: 8
A6: no_workaround | B6: 300000 | C6: 1000 | D6: 540.701800495386 | E6: AMD Ryzen 5 2400G with Radeon Vega Graphics | F6: x86_64 | G6: 8
A7: with_loc | B7: 300000 | C7: 1000 | D7: 567.921154816635 | E7: AMD Ryzen 5 2400G with Radeon Vega Graphics | F7: x86_64 | G7: 8
A8: with_workaround | B8: 300000 | C8: 1000 | D8: 442.031032536179 | E8: AMD Ryzen 5 2400G with Radeon Vega Graphics | F8: x86_64 | G8: 8
A9: no_workaround | B9: 300000 | C9: 1000 | D9: 529.270477404003 | E9: Intel(R) Core(TM) i7-4770HQ CPU @ 2.20GHz | F9: x86_64 | G9: 8
A10: with_loc | B10: 300000 | C10: 1000 | D10: 527.762633746999 | E10: Intel(R) Core(TM) i7-4770HQ CPU @ 2.20GHz | F10: x86_64 | G10: 8
A11: with_workaround | B11: 300000 | C11: 1000 | D11: 484.492259248 | E11: Intel(R) Core(TM) i7-4770HQ CPU @ 2.20GHz | F11: x86_64 | G11: 8
A12: no_workaround | B12: 300000 | C12: 1000 | D12: 420.531277493996 | E12: AMD Ryzen 5 3500U with Radeon Vega Mobile Gfx | F12: x86_64 | G12: 8
A13: with_loc | B13: 300000 | C13: 1000 | D13: 426.819339965005 | E13: AMD Ryzen 5 3500U with Radeon Vega Mobile Gfx | F13: x86_64 | G13: 8
A14: with_workaround | B14: 300000 | C14: 1000 | D14: 342.230808434004 | E14: AMD Ryzen 5 3500U with Radeon Vega Mobile Gfx | F14: x86_64 | G14: 8
A15: no_workaround | B15: 300000 | C15: 1000 | D15: 846.212536429 | E15: Intel(R) Core(TM) i5-5350U CPU @ 1.80GHz | F15: x86_64 | G15: 2
A16: with_loc | B16: 300000 | C16: 1000 | D16: 872.356522319 | E16: Intel(R) Core(TM) i5-5350U CPU @ 1.80GHz | F16: x86_64 | G16: 2
A17: with_workaround | B17: 300000 | C17: 1000 | D17: 675.583598555 | E17: Intel(R) Core(TM) i5-5350U CPU @ 1.80GHz | F17: x86_64 | G17: 2
A18: no_workaround | B18: 300000 | C18: 1000 | D18: 394.450468750001 | E18: AMD Ryzen 7 4700U with Radeon Graphics | F18: x86_64 | G18: 8
A19: with_loc | B19: 300000 | C19: 1000 | D19: 401.813538011 | E19: AMD Ryzen 7 4700U with Radeon Graphics | F19: x86_64 | G19: 8
A20: with_workaround | B20: 300000 | C20: 1000 | D20: 322.651403850999 | E20: AMD Ryzen 7 4700U with Radeon Graphics | F20: x86_64 | G20: 8
A21: no_workaround | B21: 300000 | C21: 100 | D21: 66.0964555230021 | E21: Intel(R) Core(TM) i3-7020U CPU @ 2.30GHz | F21: x86_64 | G21: 4
A22: with_loc | B22: 300000 | C22: 100 | D22: 64.250742475997 | E22: Intel(R) Core(TM) i3-7020U CPU @ 2.30GHz | F22: x86_64 | G22: 4
A23: with_workaround | B23: 300000 | C23: 100 | D23: 58.4329415309985 | E23: Intel(R) Core(TM) i3-7020U CPU @ 2.30GHz | F23: x86_64 | G23: 4